{
  "meta": {
    "total_pages": 1,
    "structure_hash": "ats-diagnostic-evidence"
  },
  "summary": {
    "id": "summary",
    "text": "Platform engineer delivering Python services."
  },
  "skills": {
    "id": "skills",
    "lines": [
      {
        "line_id": "skills_1",
        "text": "Python, Kubernetes, Communication"
      }
    ]
  },
  "experience": [
    {
      "exp_id": "exp_recent",
      "company": "Acme",
      "title": "Platform Engineer",
      "start_date": "2022-02",
      "end_date": "Present",
      "bullets": [
        {
          "bullet_id": "exp_recent_b1",
          "bullet_index": 0,
          "text": "Built Python APIs for platform services.",
          "char_count": 39
        }
      ]
    }
  ],
  "projects": [],
  "education": [
    {
      "edu_id": "edu_1",
      "school": "State University",
      "degree": "BS Computer Science",
      "start_date": "2012",
      "end_date": "2016"
    }
  ]
}
