{
  "meta": {
    "total_pages": 1,
    "structure_hash": "ats-diagnostic-plan"
  },
  "summary": {
    "id": "summary",
    "text": "Backend engineer delivering APIs."
  },
  "skills": {
    "id": "skills",
    "lines": [
      {
        "line_id": "skills_1",
        "text": "Python, AWS"
      }
    ]
  },
  "experience": [
    {
      "exp_id": "exp_recent",
      "company": "Acme",
      "title": "Backend Engineer",
      "start_date": "2022-01",
      "end_date": "Present",
      "bullets": [
        {
          "bullet_id": "exp_recent_b1",
          "bullet_index": 0,
          "text": "Built FastAPI services with Python.",
          "char_count": 35
        }
      ]
    }
  ],
  "projects": [],
  "education": [
    {
      "edu_id": "edu_1",
      "school": "State University",
      "degree": "BS Computer Science",
      "start_date": "2011",
      "end_date": "2015"
    }
  ]
}
