{
  "meta": {
    "total_pages": 1,
    "structure_hash": "ats-diagnostic-integrated"
  },
  "summary": {
    "id": "summary",
    "text": "Engineer delivering platform services."
  },
  "skills": {
    "id": "skills",
    "lines": [
      {
        "line_id": "skills_1",
        "text": "JS, ReactJS, AWS"
      }
    ]
  },
  "experience": [
    {
      "exp_id": "exp_old",
      "company": "LegacyCo",
      "title": "Systems Engineer",
      "start_date": "2019-01",
      "end_date": "2021-12",
      "bullets": [
        {
          "bullet_id": "exp_old_b1",
          "bullet_index": 0,
          "text": "Maintained Kubernetes clusters for internal tooling.",
          "char_count": 51
        }
      ]
    },
    {
      "exp_id": "exp_recent",
      "company": "NewCo",
      "title": "Platform Engineer",
      "start_date": "2022-01",
      "end_date": "Present",
      "bullets": [
        {
          "bullet_id": "exp_recent_b1",
          "bullet_index": 0,
          "text": "Built Python APIs with PostgreSQL.",
          "char_count": 33
        }
      ]
    }
  ],
  "projects": [
    {
      "project_id": "proj_ui",
      "name": "Operations Portal",
      "bullets": [
        {
          "bullet_id": "proj_ui_b1",
          "bullet_index": 0,
          "text": "Built ReactJS dashboard for operations.",
          "char_count": 39
        }
      ]
    }
  ],
  "education": [
    {
      "edu_id": "edu_1",
      "school": "State University",
      "degree": "BS Computer Science",
      "start_date": "2012",
      "end_date": "2016"
    }
  ]
}
